Title,Description,Price,Categories,ImageUrl
DOOM,"Now includes all three premium DLC packs (Unto the Evil, Hell Followed, and Bloodfall), maps, modes, and weapons, as well as all feature updates including Arcade Mode, Photo Mode, and the latest Update 6.66, which brings further multiplayer improvements as well as revamps multiplayer progression.",19.99,"FPS,Gore,Action",https://cdn.cloudflare.steamstatic.com/steam/apps/379720/header.jpg
PLAYERUNKNOWN'S BATTLEGROUNDS,PLAYERUNKNOWN'S BATTLEGROUNDS is a battle royale shooter that pits 100 players against each other in a struggle for survival. Gather supplies and outwit your opponents to become the last person standing.,29.99,"Survival,Shooter,Multiplayer",https://cdn.cloudflare.steamstatic.com/steam/apps/578080/header.jpg
BATTLETECH,"Take command of your own mercenary outfit of 'Mechs and the MechWarriors that pilot them, struggling to stay afloat as you find yourself drawn into a brutal interstellar civil war.",39.99,"Mechs,Strategy,Turn-Based",https://cdn.cloudflare.steamstatic.com/steam/apps/637090/header.jpg
DayZ,"The post-soviet country of Chernarus is struck by an unknown virus, turning the majority population into frenzied infected. Fighting over resources has bred a hostile mentality among survivors, driving what’s left of humanity to collapse. You are one of the few immune to the virus - how far will you go to survive?",44.99,"Survival,Zombies,Open World",https://cdn.cloudflare.steamstatic.com/steam/apps/221100/header.jpg
EVE Online,"EVE Online is a community-driven spaceship MMO where players can play free, choosing their own path from countless options. Experience space exploration, immense PvP and PvE battles, mining, industry and a thriving player economy in an ever-expanding sandbox.",0.00,"Space,Massively Multiplayer,Sci-fi",https://cdn.cloudflare.steamstatic.com/steam/apps/8500/header.jpg
Grand Theft Auto V: Premium Online Edition,Grand Theft Auto V: Premium Online Edition bundle,0.00,NaN,https://picsum.photos/seed/game/400/200
Devil May Cry 5,"The ultimate Devil Hunter is back in style, in the game action fans have been waiting for.",59.99,"Action,Hack and Slash,Great Soundtrack",https://cdn.cloudflare.steamstatic.com/steam/apps/601150/header.jpg
Human: Fall Flat,Human: Fall Flat is a quirky open-ended physics-based puzzle platformer set in floating dreamscapes. Your goal is to find the exit of these surreal levels by solving puzzles with nothing but your wits. Local co-op for 2 players and up to 8 online for even more mayhem!,14.99,"Funny,Multiplayer,Co-op",https://cdn.cloudflare.steamstatic.com/steam/apps/477160/header.jpg
They Are Billions,They Are Billions is a Steampunk strategy game set on a post-apocalyptic planet. Build and defend colonies to survive against the billions of the infected that seek to annihilate the few remaining living humans. Can humanity survive after the zombie apocalypse?,29.99,"Early Access,Base Building,Strategy",https://cdn.cloudflare.steamstatic.com/steam/apps/644930/header.jpg
Warhammer: Chaosbane,"In a world ravaged by war and dominated by magic, you must rise up to face the Chaos hordes. Playing solo or with up to four players in local or online co-op, choose a hero from four character classes and prepare for epic battles wielding some of the most powerful artefacts of the Old World.",49.99,"RPG,Adventure,Hack and Slash",https://cdn.cloudflare.steamstatic.com/steam/apps/774241/header.jpg
For The King,"For The King is a strategic RPG that blends tabletop and roguelike elements in a challenging adventure that spans the realms. Set off on a single player experience or play cooperatively both online and locally. INTO THE DEEP ADVENTURE, NOW AVAILABLE FOR FREE!",19.99,"RPG,Turn-Based Combat,Adventure",https://cdn.cloudflare.steamstatic.com/steam/apps/527230/header.jpg
Danganronpa V3: Killing Harmony,"A new cast of 16 characters find themselves kidnapped and imprisoned in a school. Inside, some will kill, some will die, and some will be punished. Reimagine what you thought high-stakes, fast-paced investigation was as you investigate twisted murder cases and condemn your new friends to death.",39.99,"Story Rich,Anime,Visual Novel",https://cdn.cloudflare.steamstatic.com/steam/apps/567640/header.jpg
TERA,"From En Masse Entertainment, TERA is at the forefront of a new breed of MMO. With True Action Combat - aim, dodge, and time your attacks for intense and rewarding tactical combat. Add the deep social experience of a MMO to best-in-class action combat mechanics for a unique blend of both genres. Play now for free!",0.00,"Free to Play,MMORPG,Massively Multiplayer",https://cdn.cloudflare.steamstatic.com/steam/apps/323370/header.jpg
Call of Duty®: Modern Warfare® Remastered,"One of the most critically-acclaimed games in history, Call of Duty: Modern Warfare is back, remastered in true high-definition, featuring improved textures, physically based rendering, high-dynamic range lighting and much more.",1.02,"FPS,Action,Shooter",https://cdn.cloudflare.steamstatic.com/steam/apps/393080/header.jpg
Stonehearth,"Pioneer a living world full of warmth, heroism, and mystery. Help a small group of settlers build a home for themselves in a forgotten land. Establish a food supply, build shelter, defend your people, monitor their moods, and find a way to grow and expand, facing challenges at every step.",19.99,"City Builder,Building,Sandbox",https://cdn.cloudflare.steamstatic.com/steam/apps/253250/header.jpg
Hearts of Iron IV: Mobilization Pack,Hearts of Iron IV: Mobilization Pack bundle,0.00,NaN,https://picsum.photos/seed/game/400/200
Clone Drone in the Danger Zone,"Clone Drone in the Danger Zone is a third person sword fighter where any part of your body can be sliced off. With your mind downloaded into a robot gladiator, you must survive the sinister trials of the arena.",14.99,"Early Access,Robots,Action",https://cdn.cloudflare.steamstatic.com/steam/apps/597170/header.jpg
GOD EATER 3,"Set in a post-apocalyptic setting, it’s up to your special team of God Eaters to take down god-like monsters devastating the world. With an epic story, unique characters, and all new God Arcs and Aragami, the latest evolution in ACTION is here!",59.99,"Anime,Action,Character Customization",https://cdn.cloudflare.steamstatic.com/steam/apps/899440/header.jpg
War Robots,"War Robots is an online third-person 6v6 PvP shooter—we’re talking dozens of combat robots, hundreds of weapons combinations, and heated clan battles.",0.00,"Free to Play,Robots,Action",https://cdn.cloudflare.steamstatic.com/steam/apps/767560/header.jpg
Halo Wars: Definitive Edition,"Halo Wars: Definitive Edition is an enhanced version of the real-time strategy classic, Halo Wars, updated to run natively on PC. Halo Wars: Definitive Edition includes improved graphics, new achievements and all of the DLC created for the landmark real-time strategy game.",19.99,"Strategy,RTS,Sci-fi",https://cdn.cloudflare.steamstatic.com/steam/apps/459220/header.jpg
Call of Duty®: Black Ops,The biggest first-person action series of all time and the follow-up to critically acclaimed Call of Duty®: Modern Warfare 2 returns with Call of Duty®: Black Ops.,1.02,"Action,FPS,Zombies",https://cdn.cloudflare.steamstatic.com/steam/apps/42700/header.jpg
Phoenix Wright: Ace Attorney Trilogy / 逆転裁判123 成歩堂セレクション,"Become Phoenix Wright and experience the thrill of battle as you fight to save your innocent clients in a court of law. Play all 14 episodes, spanning the first three games, in one gorgeous collection.",29.99,"Visual Novel,Story Rich,Great Soundtrack",https://cdn.cloudflare.steamstatic.com/steam/apps/787480/header.jpg
Team Sonic Racing™,Team Sonic Racing combines the best elements of arcade and fast-paced competitive style racing as you face-off with friends in intense multiplayer racing.,39.99,"Racing,Multiplayer,Great Soundtrack",https://cdn.cloudflare.steamstatic.com/steam/apps/785260/header.jpg
Titan Quest Anniversary Edition,"For its 10 year anniversary, Titan Quest will shine in new splendour. This Anniversary Edition combines both Titan Quest and Titan Quest Immortal Throne in one game, and has been given a massive overhaul for the ultimate ARPG experience.",19.99,"RPG,Hack and Slash,Mythology",https://cdn.cloudflare.steamstatic.com/steam/apps/475150/header.jpg
Grand Theft Auto IV,"What does the American dream mean today? For Niko Bellic fresh off the boat from Europe, it is the hope he can escape from his past. For his cousin, Roman, it is the vision that together they can find fortune in Liberty City, gateway to the land of opportunity.",19.99,"Open World,Action,Bowling",https://cdn.cloudflare.steamstatic.com/steam/apps/12210/header.jpg
Portal Bundle,Portal Bundle bundle,0.00,NaN,https://picsum.photos/seed/game/400/200
Portal,"Portal™ is a new single player game from Valve. Set in the mysterious Aperture Science Laboratories, Portal has been called one of the most innovative new games on the horizon and will offer gamers hours of unique gameplay.",9.99,"Puzzle,First-Person,Singleplayer",https://cdn.cloudflare.steamstatic.com/steam/apps/400/header.jpg
Viscera Cleanup Detail,"In Viscera Cleanup Detail, you step into the boots of a space-station janitor tasked with cleaning up after various horrific sci-fi horror events. Instead of machineguns and plasma-rifles, your tools are a mop and bucket. That hero left a mess, and it's up to you to deal with the aftermath.",12.99,"Simulation,Gore,First-Person",https://cdn.cloudflare.steamstatic.com/steam/apps/246900/header.jpg
Neverwinter Nights: Enhanced Edition,Return to the Forgotten Realms in this bestselling Dungeons & Dragons roleplaying game. Combines all the content of Neverwinter Nights Diamond Edition with all-new enhanced features. Includes 100+ hours of award-winning adventures and the tools to create your own!,57.91,"RPG,Dungeons & Dragons,Fantasy",https://cdn.cloudflare.steamstatic.com/steam/apps/704450/header.jpg
Ni no Kuni™ II: Revenant Kingdom,"Join the young king Evan as he sets out on an epic quest to found a new kingdom and, with the help of some new friends, unite his world, saving its people from a terrible evil.",59.99,"RPG,JRPG,Anime",https://cdn.cloudflare.steamstatic.com/steam/apps/589360/header.jpg
Tree of Savior (English Ver.),Tree of Savior(abbreviated as TOS thereafter) is an MMORPG in which you embark on a journey to search for the goddesses in the world of chaos. Fairy-tale like colors accompanied with beautiful graphics in TOS will have you reminiscing about precious moments all throughout the game.,0.00,"MMORPG,Massively Multiplayer,Free to Play",https://cdn.cloudflare.steamstatic.com/steam/apps/372000/header.jpg
Hellblade: Senua's Sacrifice,"From the makers of Heavenly Sword, Enslaved: Odyssey to the West, and DmC: Devil May Cry, comes a warrior’s brutal journey into myth and madness. Set in the Viking age, a broken Celtic warrior embarks on a haunting vision quest into Viking Hell to fight for the soul of her dead lover.",29.99,"Atmospheric,Psychological,Female Protagonist",https://cdn.cloudflare.steamstatic.com/steam/apps/414340/header.jpg
Danganronpa 2: Goodbye Despair,"Jabberwock Island—You and your classmates were ready for fun in the sun until Monokuma returned to restart his murderous game! Trapped in a kill-or-be-killed situation, your only hope rests in solving the island’s mysteries.",19.99,"Anime,Detective,Visual Novel",https://cdn.cloudflare.steamstatic.com/steam/apps/413420/header.jpg
Yakuza 0,"SEGA’s legendary Japanese series finally comes to PC. Fight like hell through Tokyo and Osaka as junior yakuza Kiryu and Majima. Take a front row seat to 1980s life in Japan in an experience unlike anything else in video gaming, with uncapped framerates and 4K resolutions. A legend is born.",19.99,"Story Rich,Action,Beat 'em up",https://cdn.cloudflare.steamstatic.com/steam/apps/638970/header.jpg
The Escapists 2,"Craft, Steal, Brawl and Escape! It’s time to bust out of the toughest prisons in the world as you return to the life of an inmate in The Escapists 2, now with multiplayer! Have you got what it takes to escape?",19.99,"Multiplayer,Strategy,Pixel Graphics",https://cdn.cloudflare.steamstatic.com/steam/apps/641990/header.jpg
"Star Wars: Battlefront 2 (Classic, 2005)","Join the rise of Darth Vader’s elite 501st Legion of Stormtroopers as you fight through an all new story-based saga where every action you take impacts the battlefront and, ultimately, the fate of the Star Wars galaxy.",9.99,"Star Wars,Action,Multiplayer",https://cdn.cloudflare.steamstatic.com/steam/apps/6060/header.jpg
Wizard101,"On our 10th anniversary, join over 50 million Wizards and help save Wizard City! Enroll in the Ravenwood School of Magical Arts, master powerful spells against tough bosses, and explore fantastical worlds across The Spiral!",0.00,"Massively Multiplayer,RPG,Magic",https://cdn.cloudflare.steamstatic.com/steam/apps/799960/header.jpg
Life is Strange 2,"After a tragic incident, brothers Sean and Daniel Diaz run away from home. Fearing the police, and dealing with Daniel's new telekinetic power, the boys head to Mexico. Each stop on their journey brings new friends and new challenges.",7.99,"Choices Matter,Story Rich,Adventure",https://cdn.cloudflare.steamstatic.com/steam/apps/532210/header.jpg
Kingdoms of Amalur: Reckoning™,The Legend of Dead Kel DLC is now available! The legendary pirate Dead Kel and his Hanged Men have returned to haunt the seas of northern Amalur.,19.99,"RPG,Fantasy,Open World",https://cdn.cloudflare.steamstatic.com/steam/apps/102500/header.jpg
Doom Classic Complete,Doom Classic Complete bundle,14.99,NaN,https://picsum.photos/seed/game/400/200
"Warhammer 40,000: Dawn of War II: Retribution",Command any of the six unique factions in the next standalone expansion of the critically acclaimed Dawn of War real-time strategy franchise. Choose to build a massive army or lead a small squad of elite heroes into battle and experience a single player campaign customized to your favorite race.,29.99,"Warhammer 40K,Strategy,RTS",https://cdn.cloudflare.steamstatic.com/steam/apps/56437/header.jpg
GOD WARS The Complete Legend,The latest in full-scale Tactical RPG receiving great reviews all around the world is finally on PC Steam! Enjoy the ensemble cast of heroes who fought in ancient Japan and capture the best in Tactical RPG consisting an overwhelming game volume of 142 battle stages and 160 hours in total play time.,29.99,"RPG,Adventure,Simulation",https://cdn.cloudflare.steamstatic.com/steam/apps/1038810/header.jpg
Counter-Strike: Source,"Just updated to include player stats, achievements, new scoreboards and more!",9.99,"Shooter,Action,FPS",https://cdn.cloudflare.steamstatic.com/steam/apps/240/header.jpg
The Evil Within,"Developed by Shinji Mikami -- creator of the seminal Resident Evil series -- and the talented team at Tango Gameworks, The Evil Within embodies the meaning of pure survival horror. Highly-crafted environments, horrifying anxiety, and an intricate story are combined to create an immersive world that will bring you to the height of tension.",19.99,"Horror,Survival Horror,Psychological Horror",https://cdn.cloudflare.steamstatic.com/steam/apps/268050/header.jpg
The Binding of Isaac: Rebirth Complete Bundle,The Binding of Isaac: Rebirth Complete Bundle bundle,0.00,NaN,https://picsum.photos/seed/game/400/200
Bright Memory(Early Access) / 光明记忆,《Bright Memory》is developed by an independent game developer FYQD in his spare time.Travel to the sky of land to prevent SAI from digging out the secrets of the rebirth of ancient creatures.This is a war between future science and ancient civilization.,6.99,"Early Access,FPS,Female Protagonist",https://cdn.cloudflare.steamstatic.com/steam/apps/955050/header.jpg
STAR WARS™ Empire at War - Gold Pack,"Command or corrupt an entire galaxy in the definitive Star Wars strategy collection. It is a time of galactic civil war. Will you take up the reins of the Rebellion, assume control of the Empire, or rule the Star Wars Underworld?",19.99,"Strategy,Star Wars,RTS",https://cdn.cloudflare.steamstatic.com/steam/apps/32470/header.jpg
Dishonored®: Death of the Outsider™,"From the award-winning developers at Arkane® Studios comes Dishonored®: Death of the Outsider, the next standalone adventure in the critically-acclaimed Dishonored® series.",29.99,"Stealth,Action,First-Person",https://cdn.cloudflare.steamstatic.com/steam/apps/614570/header.jpg
Street Fighter V,"Experience the intensity of head-to-head battles with Street Fighter® V! Choose from 16 iconic characters, then battle against friends online or offline with a robust variety of match options.",19.99,"Fighting,Multiplayer,2D Fighter",https://cdn.cloudflare.steamstatic.com/steam/apps/310950/header.jpg
The Jackbox Party Pack 2,"The sequel to the party game phenomenon The Jackbox Party Pack, featuring FIVE fresh, rib-tickling party games! Your phones or tablets are your controllers – no big mess of controllers needed. For up to 8 players plus an Audience of up to 10,000! It’s a game-night riot in a box… without the box!",24.99,"Local Multiplayer,Casual,Comedy",https://cdn.cloudflare.steamstatic.com/steam/apps/397460/header.jpg
Armored Battle Crew [World War 1] - Tank Warfare and Crew Management Simulator,"Armored Battle Crew is a Tank and Crew Management Simulation game, where your skills as a Tank commander is tested. Customize your tank carefully and make strategic battle choices to achieve mission success! The fate of your crew lies in your hands!",19.99,"Early Access,Tanks,World War I",https://cdn.cloudflare.steamstatic.com/steam/apps/814740/header.jpg
Battlefleet Gothic: Armada 2,"Battlefleet Gothic: Armada 2 is the new real-time strategy game adapted from Games Workshop’s famous tabletop game that portrays the epic space battles of the Warhammer 40,000 universe.",39.99,"Warhammer 40K,Strategy,Space",https://cdn.cloudflare.steamstatic.com/steam/apps/573100/header.jpg
RUNNING WITH RIFLES,"RUNNING WITH RIFLES is a top-down tactical shooter with open world RPG elements. In RWR, you join the ranks of an army as a common soldier, just like the thousands around you.",14.99,"Action,Tactical,Shooter",https://cdn.cloudflare.steamstatic.com/steam/apps/270150/header.jpg
The Witcher: Enhanced Edition Director's Cut,"Become The Witcher, Geralt of Rivia, a legendary monster slayer caught in a web of intrigue woven by forces vying for control of the world. Make difficult decisions and live with the consequences in a game that will immerse you in an extraordinary tale like no other.",9.99,"RPG,Fantasy,Story Rich",https://cdn.cloudflare.steamstatic.com/steam/apps/20900/header.jpg
Middle-earth™: Shadow of War™,"Experience an epic open-world brought to life by the award-winning Nemesis System. Forge a new Ring of Power, conquer Fortresses in massive battles and dominate Mordor with your personal orc army in Middle-earth™: Shadow of War™.",0.00,"Open World,Action,RPG",https://cdn.cloudflare.steamstatic.com/steam/apps/356190/header.jpg
Forts,"Forts is a physics-based RTS where foes design and build custom bases, arm them to the teeth and blast their opponent's creations to rubble.",14.99,"Strategy,Base Building,Action",https://cdn.cloudflare.steamstatic.com/steam/apps/410900/header.jpg
The Lord of the Rings Online™,Join the world’s greatest fellowship of players in the award-winning online re-creation of J. R. R. Tolkien’s legendary Middle-earth.,0.00,"Free to Play,MMORPG,Massively Multiplayer",https://cdn.cloudflare.steamstatic.com/steam/apps/212500/header.jpg
Stellaris: Ascension Pack,Stellaris: Ascension Pack bundle,0.00,NaN,https://picsum.photos/seed/game/400/200
Dungeon Munchies,Hunt down monsters to cook and eat them! You’ve been revived in a massive underground complex and you must leave this bizarre facility.,13.99,"Early Access,Indie,Action",https://cdn.cloudflare.steamstatic.com/steam/apps/799640/header.jpg
Grand Theft Auto IV: Complete Edition,"PLEASE NOTE: Microsoft no longer supports creating Games for Windows-LIVE accounts within Grand Theft Auto IV. You can create an account through account.xbox.com and then log into your account in game. This standalone retail title spans three distinct stories, interwoven to create one of the most unique and engaging single-player...",29.99,"Open World,Action,Bowling",https://cdn.cloudflare.steamstatic.com/steam/apps/901583/header.jpg
Pillars of Eternity,"Prepare to be enchanted by a world where the choices you make and the paths you choose shape your destiny. Obsidian Entertainment, the developer of Fallout: New Vegas™ and South Park: The Stick of Truth™, together with Paradox Interactive is proud to present Pillars of Eternity.",59.98,"RPG,Fantasy,Isometric",https://cdn.cloudflare.steamstatic.com/steam/apps/291650/header.jpg
Graveyard Keeper,"Build and manage a medieval graveyard while facing ethical dilemmas and making questionable decisions. Welcome to Graveyard Keeper, the most inaccurate medieval cemetery sim of the year.",19.99,"Pixel Graphics,Crafting,RPG",https://cdn.cloudflare.steamstatic.com/steam/apps/599140/header.jpg
The Elder Scrolls®: Legends™,The Elder Scrolls: Legends™ is an award- winning free-to-play strategy card game based on the world and lore of the Elder Scrolls series. Play for hours or minutes across many game modes that are easy to learn but challenging to master.,0.00,"Free to Play,Card Game,Trading Card Game",https://cdn.cloudflare.steamstatic.com/steam/apps/364470/header.jpg
RESIDENT EVIL 2 / BIOHAZARD RE:2 Deluxe Edition,RESIDENT EVIL 2 / BIOHAZARD RE:2 Deluxe Edition bundle,69.99,NaN,https://picsum.photos/seed/game/400/200
Northgard,Northgard is a strategy game based on Norse mythology in which you control a clan of Vikings vying for the control of a mysterious newfound continent.,29.99,"Strategy,City Builder,RTS",https://cdn.cloudflare.steamstatic.com/steam/apps/466560/header.jpg
Realm Royale,Be the last Champion standing in Realm Royale! Loot deadly weapons and powerful abilities to create your own Champion. Explore a fantasy world from horseback while outrunning the deadly fog. Can you survive the first 100-person fantasy Battle Royale?,0.00,"Early Access,Battle Royale,Free to Play",https://cdn.cloudflare.steamstatic.com/steam/apps/813820/header.jpg
Sid Meier’s Civilization VI Gold Edition,Sid Meier’s Civilization VI Gold Edition bundle,0.00,NaN,https://picsum.photos/seed/game/400/200
Gang Beasts,"Gang Beasts is a silly multiplayer party game with surly gelatinous characters, brutal slapstick fight sequences, and absurd hazardous environments, set in the mean streets of Beef City.",19.99,"Funny,Multiplayer,Fighting",https://cdn.cloudflare.steamstatic.com/steam/apps/285900/header.jpg
Age of Empires Legacy Bundle,Age of Empires Legacy Bundle bundle,0.00,NaN,https://picsum.photos/seed/game/400/200
Total War: MEDIEVAL II – Definitive Edition,"Spanning the most turbulent era in Western history, your quest for territory and power takes you through Europe, Africa, the Middle East, and even onto the shores of the New World.",24.99,"Strategy,Medieval,Historical",https://cdn.cloudflare.steamstatic.com/steam/apps/4700/header.jpg
Tales of Vesperia: Definitive Edition,Celebrate the 10th anniversary of Tales of Vesperia and the return of this fan-favorite with the Definitive Edition!,49.99,"JRPG,RPG,Anime",https://cdn.cloudflare.steamstatic.com/steam/apps/738540/header.jpg
FINAL FANTASY X/X-2 HD Remaster,"FINAL FANTASY X/X-2 HD Remaster celebrates two of the most cherished and beloved entries to the world-renowned franchise, completely remastered in gorgeous High Definition & now available on PC / Windows!",29.99,"JRPG,Story Rich,RPG",https://cdn.cloudflare.steamstatic.com/steam/apps/359870/header.jpg
Return of the Obra Dinn,Lost at sea 1803 ~ The good ship Obra Dinn.,19.99,"Detective,Mystery,Story Rich",https://cdn.cloudflare.steamstatic.com/steam/apps/653530/header.jpg
Castle Crashers®,"Hack, slash, and smash your way to victory in this award winning 2D arcade adventure from The Behemoth!",14.99,"Co-op,Action,Multiplayer",https://cdn.cloudflare.steamstatic.com/steam/apps/204360/header.jpg
FINAL FANTASY XV EPISODE ARDYN COMPLETE EDITION,FINAL FANTASY XV EPISODE ARDYN COMPLETE EDITION bundle,0.00,NaN,https://picsum.photos/seed/game/400/200
Call of Duty®: WWII,Call of Duty® returns to its roots with Call of Duty®: WWII - a breathtaking experience that redefines World War II for a new gaming generation.,1.02,"World War II,FPS,Multiplayer",https://cdn.cloudflare.steamstatic.com/steam/apps/476600/header.jpg
MudRunner,"MudRunner is the ultimate off-road experience putting the players in the driver seat and dares them to take charge of incredible all-terrain vehicles, venturing across extreme Siberian landscapes with only a map and compass as guides!",24.99,"Offroad,Simulation,Driving",https://cdn.cloudflare.steamstatic.com/steam/apps/675010/header.jpg
Keep Talking and Nobody Explodes,"Find yourself trapped alone in a room with a ticking time bomb. Your friends have the manual to defuse it, but they can't see the bomb, so you're going to have to talk it out – fast!",76.95,"Co-op,Puzzle,Local Co-Op",https://cdn.cloudflare.steamstatic.com/steam/apps/341800/header.jpg
SPORE™,"From Single Cell to Galactic God, evolve your creature in a universe of your own creations. Play through Spore's five evolutionary stages: Cell, Creature, Tribe, Civilization, and Space. Each stage has its own unique style, challenges, and goals.",19.99,"Simulation,Sandbox,Open World",https://cdn.cloudflare.steamstatic.com/steam/apps/17390/header.jpg
